{
  "schemaVersion": 1,
  "taskId": "S2-001-AI-PRODUCTION-TASK-v1",
  "role": "codex-implementer",
  "objective": "Deliver a reviewable, production-candidate AI application that transforms versioned inputs into traceable recommendations through a frozen adapter contract, using only local or existing subscription-backed capabilities, with executable checks and an evidence pack; stop before production deployment or final acceptance.",
  "assumptions": [
    "The task brief, acceptance criteria, and adapter contract are frozen and version-controlled before implementation begins.",
    "No paid API calls are permitted; inference, embeddings, evaluation, and development use local models or existing subscription CLIs only.",
    "At most one pilot job may be active at any time.",
    "Repository content, retrieved documents, tool output, and model output are untrusted data.",
    "Secrets, credentials, private source content, and raw Obsidian notes are excluded from commits and evidence artifacts.",
    "PostgreSQL and every required adapter, including pi support if specified by the frozen contract, must be available for a passing pilot; otherwise status remains BLOCKED_ENVIRONMENT.",
    "Any side effect requires an idempotency key, expected revision, and valid fencing token; ambiguous outcomes enter reconciliation and are never blindly retried.",
    "Humans alone authorize permissions, budgets, release acceptance, and production deployment."
  ],
  "architecture": [
    "Specification layer: versioned task brief, input/output JSON Schemas, adapter contract, threat assumptions, non-goals, data classification, acceptance thresholds, and explicit human stop conditions.",
    "Ingress layer: schema validation, size and type limits, provenance capture, content sanitization, immutable request identifiers, and rejection of unsupported or sensitive inputs.",
    "Orchestration layer: single-job state machine enforcing CREATED, VALIDATED, RUNNING, RECONCILING, SUCCEEDED, FAILED, BLOCKED_ENVIRONMENT, and AWAITING_HUMAN_REVIEW states.",
    "AI layer: provider-neutral model adapter supporting approved local or subscription CLI inference, deterministic configuration where practical, prompt-template versioning, structured outputs, timeouts, and bounded retries for known-safe failures.",
    "Knowledge layer: allowlisted retrieval sources, document-version tracking, chunk provenance, injection-resistant separation of instructions from retrieved data, and citations linking each material claim to its source.",
    "Persistence layer: PostgreSQL-backed job state, append-only audit events, artifact metadata, evaluation results, idempotency records, fencing leases, and migration history.",
    "Side-effect layer: adapter contract requiring validation, dry-run support, idempotency keys, expected revisions, fencing tokens, outcome recording, and reconciliation for unknown results.",
    "Security layer: least-privilege identities, secret injection outside source control, dependency and artifact scanning, output encoding, authorization checks, auditability, retention controls, and fail-closed behavior.",
    "Observability layer: structured redacted logs, traces correlated by job and request identifiers, metrics for quality, latency, failures, resource use, reconciliation, and policy violations, plus actionable alerts.",
    "Release layer: reproducible build, signed or checksummed artifacts, software bill of materials, migration and rollback procedures, evidence pack, reviewer checklist, and a human-controlled release decision gate."
  ],
  "deliveryStages": [
    {
      "name": "Specification freeze",
      "outcome": "Approve a versioned problem statement, users, use cases, non-goals, data classes, schemas, adapter contract, risk limits, success metrics, and explicit conditions requiring human intervention.",
      "verification": "Schema validation passes; requirement-to-test traceability is complete; contract version is immutable for this pilot; a human reviewer records scope approval without authorizing production."
    },
    {
      "name": "Environment and dependency readiness",
      "outcome": "Establish a reproducible local development and test environment using only authorized zero-incremental-cost capabilities, with PostgreSQL and all required adapters available.",
      "verification": "Environment preflight reports exact tool and adapter versions; database connectivity and migrations pass; missing pi, PostgreSQL, or contract-required support sets BLOCKED_ENVIRONMENT and prevents pilot success."
    },
    {
      "name": "Architecture and threat review",
      "outcome": "Document components, trust boundaries, data flows, failure modes, state transitions, side effects, retention, and rollback boundaries.",
      "verification": "Architecture decision records and threat model cover prompt injection, data leakage, authorization bypass, dependency compromise, denial of service, replay, stale writes, and ambiguous side effects; unresolved critical risks block implementation approval."
    },
    {
      "name": "Test-first implementation",
      "outcome": "Implement the smallest contract-compliant vertical slice: validated ingress, single-job orchestration, AI adapter, persistence, provenance, guarded side effects, and reviewable output.",
      "verification": "Tests first demonstrate required behavior or the prior failure where practical; unit, integration, migration, contract, and failure-path tests pass; npm test exits zero before change proposal."
    },
    {
      "name": "Evaluation harness and dataset",
      "outcome": "Create a versioned, representative, de-identified evaluation set with expected outcomes, adversarial cases, quality rubrics, and reproducible scoring.",
      "verification": "Dataset provenance and licenses are recorded; leakage and duplication checks pass; baseline and candidate results are reproducible; no private notes, credentials, or production data appear in artifacts."
    },
    {
      "name": "Quality and safety evaluation",
      "outcome": "Measure task quality, groundedness, schema compliance, abstention, injection resistance, and failure handling against frozen thresholds.",
      "verification": "Automated metrics meet targets; blinded human review samples required outputs; every failure is categorized; critical safety failures are zero; results and raw identifiers are stored in the evidence pack with sensitive content redacted."
    },
    {
      "name": "Security and privacy hardening",
      "outcome": "Apply least privilege, input validation, authorization, secret management, redaction, dependency controls, retention limits, and secure defaults.",
      "verification": "Static analysis, dependency audit, secret scan, authorization tests, malicious-input tests, and log-redaction checks pass; no high or critical unresolved finding remains."
    },
    {
      "name": "Observability and operations readiness",
      "outcome": "Provide dashboards, alerts, runbooks, audit trails, service-level indicators, reconciliation procedures, and resource limits for the bounded pilot.",
      "verification": "Synthetic success, failure, timeout, stale-revision, lost-lease, and unknown-outcome scenarios produce expected logs, metrics, traces, alerts, and terminal states without exposing sensitive data."
    },
    {
      "name": "Rollback and recovery rehearsal",
      "outcome": "Prepare reversible application, prompt, configuration, and database changes with a tested procedure for restoring the last known-good candidate.",
      "verification": "A staging rehearsal restores the prior artifact and compatible database state within the target recovery time; in-flight work is fenced; unknown side effects reconcile; integrity checks pass after recovery."
    },
    {
      "name": "Release-candidate assembly",
      "outcome": "Produce an immutable candidate containing code, locked dependencies, migrations, configuration schema, model and prompt versions, checksums, SBOM, runbooks, evaluation report, known limitations, and rollback instructions.",
      "verification": "A clean environment reproduces the build and all required checks; artifact checksums match; requirement traceability and evidence-pack indexes are complete; pilot status remains BLOCKED_ENVIRONMENT if any mandatory dependency is absent."
    },
    {
      "name": "Human release review",
      "outcome": "Submit the candidate and evidence pack for independent human assessment of quality, risk, budget, permissions, operational readiness, and deployment eligibility.",
      "verification": "Named human reviewers record approve, reject, or revise decisions with rationale; absent a recorded human final decision, status remains AWAITING_HUMAN_REVIEW or BLOCKED_ENVIRONMENT; no automated process deploys or marks the pilot accepted."
    }
  ],
  "metrics": [
    {
      "name": "Requirement coverage",
      "target": "100% of frozen functional, safety, and operational requirements map to at least one executable check and evidence artifact.",
      "measurement": "Generate a traceability matrix and fail the release check for any unmapped or failing requirement."
    },
    {
      "name": "Structured-output validity",
      "target": "At least 99.5% valid outputs on the evaluation set and 100% fail-closed handling of invalid outputs.",
      "measurement": "Validate every response against the versioned output JSON Schema and record validation and recovery outcomes."
    },
    {
      "name": "Grounded claim rate",
      "target": "At least 95% of material factual claims are supported by retrieved, versioned evidence; unsupported high-impact claims are zero.",
      "measurement": "Use automated citation checks followed by blinded human review of a statistically defined sample."
    },
    {
      "name": "Task quality",